{
  "documentVersion": 2,
  "locale": "en",
  "description": "Growth-screen rules and presentation only. Combat receives resolved GameInformation, never this configuration.",
  "progression": {
    "savedProgressPolicy": "overlay",
    "initialBossTier": 0,
    "categories": [
      {
        "id": "stat.attack",
        "tab": "stats",
        "nodes": [
          {
            "id": "stat.attack.01",
            "displayName": "Research Core",
            "description": "Central start point. Activate it to reveal the first cardinal research options.",
            "valueLabel": "Start research",
            "cost": 0,
            "currencyId": "gem.garnet",
            "requiredBossTier": 0,
            "prerequisiteNodeId": "",
            "startsUnlocked": false,
            "operation": "baseline",
            "value": 0
          },
          {
            "id": "stat.attack.02",
            "displayName": "Attack Power 2",
            "description": "Add 2 attack power.",
            "valueLabel": "+2",
            "cost": 40,
            "currencyId": "gem.garnet",
            "requiredBossTier": 0,
            "prerequisiteNodeId": "stat.attack.01",
            "startsUnlocked": false,
            "operation": "add",
            "value": 2
          },
          {
            "id": "stat.attack.03",
            "displayName": "Attack Power 3",
            "description": "Add 3 attack power.",
            "valueLabel": "+3",
            "cost": 65,
            "currencyId": "gem.topaz",
            "requiredBossTier": 1,
            "prerequisiteNodeId": "stat.attack.02",
            "startsUnlocked": false,
            "operation": "add",
            "value": 3
          },
          {
            "id": "stat.attack.04",
            "displayName": "Attack Power 4",
            "description": "Add 4 attack power.",
            "valueLabel": "+4",
            "cost": 90,
            "currencyId": "gem.topaz",
            "requiredBossTier": 1,
            "prerequisiteNodeId": "stat.attack.03",
            "startsUnlocked": false,
            "operation": "add",
            "value": 4
          },
          {
            "id": "stat.attack.05",
            "displayName": "Attack Power 5",
            "description": "Add 6 attack power.",
            "valueLabel": "+6",
            "cost": 115,
            "currencyId": "gem.amethyst",
            "requiredBossTier": 2,
            "prerequisiteNodeId": "stat.attack.04",
            "startsUnlocked": false,
            "operation": "add",
            "value": 6
          },
          {
            "id": "stat.attack.06",
            "displayName": "Attack Power 6",
            "description": "Add 8 attack power.",
            "valueLabel": "+8",
            "cost": 140,
            "currencyId": "gem.sapphire",
            "requiredBossTier": 2,
            "prerequisiteNodeId": "stat.attack.05",
            "startsUnlocked": false,
            "operation": "add",
            "value": 8
          },
          {
            "id": "stat.attack.07",
            "displayName": "Attack Power 7",
            "description": "Add 11 attack power.",
            "valueLabel": "+11",
            "cost": 165,
            "currencyId": "gem.sapphire",
            "requiredBossTier": 3,
            "prerequisiteNodeId": "stat.attack.06",
            "startsUnlocked": false,
            "operation": "add",
            "value": 11
          },
          {
            "id": "stat.attack.08",
            "displayName": "Attack Power 8",
            "description": "Add 15 attack power.",
            "valueLabel": "+15",
            "cost": 190,
            "currencyId": "gem.diamond",
            "requiredBossTier": 3,
            "prerequisiteNodeId": "stat.attack.07",
            "startsUnlocked": false,
            "operation": "add",
            "value": 15
          },
          {
            "id": "stat.attack.09",
            "displayName": "Attack Power 9",
            "description": "Add 20 attack power.",
            "valueLabel": "+20",
            "cost": 215,
            "currencyId": "gem.diamond",
            "requiredBossTier": 4,
            "prerequisiteNodeId": "stat.attack.08",
            "startsUnlocked": false,
            "operation": "add",
            "value": 20
          },
          {
            "id": "stat.attack.10",
            "displayName": "Attack Power 10",
            "description": "Add 30 attack power.",
            "valueLabel": "+30",
            "cost": 240,
            "currencyId": "gem.dragon",
            "requiredBossTier": 5,
            "prerequisiteNodeId": "stat.attack.09",
            "startsUnlocked": false,
            "operation": "add",
            "value": 30
          }
        ]
      },
      {
        "id": "stat.radius",
        "tab": "stats",
        "nodes": [
          {
            "id": "stat.radius.01",
            "displayName": "Automatic Radius 1",
            "description": "Baseline is read from the PlayerCombatStatsDefaults component.",
            "valueLabel": "Component baseline",
            "cost": 0,
            "currencyId": "gem.garnet",
            "requiredBossTier": 0,
            "prerequisiteNodeId": "stat.attack.01",
            "startsUnlocked": false,
            "operation": "baseline",
            "value": 0
          },
          {
            "id": "stat.radius.02",
            "displayName": "Automatic Radius 2",
            "description": "Add 0.1725381u to the cursor attack radius.",
            "valueLabel": "+0.1725381u",
            "cost": 40,
            "currencyId": "gem.garnet",
            "requiredBossTier": 0,
            "prerequisiteNodeId": "stat.radius.01",
            "startsUnlocked": false,
            "operation": "add",
            "value": 0.1725381
          },
          {
            "id": "stat.radius.03",
            "displayName": "Automatic Radius 3",
            "description": "Add 0.1725381u to the cursor attack radius.",
            "valueLabel": "+0.1725381u",
            "cost": 65,
            "currencyId": "gem.topaz",
            "requiredBossTier": 1,
            "prerequisiteNodeId": "stat.radius.02",
            "startsUnlocked": false,
            "operation": "add",
            "value": 0.1725381
          },
          {
            "id": "stat.radius.04",
            "displayName": "Automatic Radius 4",
            "description": "Add 0.1725381u to the cursor attack radius.",
            "valueLabel": "+0.1725381u",
            "cost": 90,
            "currencyId": "gem.topaz",
            "requiredBossTier": 1,
            "prerequisiteNodeId": "stat.radius.03",
            "startsUnlocked": false,
            "operation": "add",
            "value": 0.1725381
          },
          {
            "id": "stat.radius.05",
            "displayName": "Automatic Radius 5",
            "description": "Add 0.1725381u to the cursor attack radius.",
            "valueLabel": "+0.1725381u",
            "cost": 115,
            "currencyId": "gem.amethyst",
            "requiredBossTier": 2,
            "prerequisiteNodeId": "stat.radius.04",
            "startsUnlocked": false,
            "operation": "add",
            "value": 0.1725381
          },
          {
            "id": "stat.radius.06",
            "displayName": "Automatic Radius 6",
            "description": "Add 0.1725380u to the cursor attack radius.",
            "valueLabel": "+0.1725380u",
            "cost": 140,
            "currencyId": "gem.amethyst",
            "requiredBossTier": 2,
            "prerequisiteNodeId": "stat.radius.05",
            "startsUnlocked": false,
            "operation": "add",
            "value": 0.172538
          },
          {
            "id": "stat.radius.07",
            "displayName": "Automatic Radius 7",
            "description": "Add 0.8626905u to the cursor attack radius.",
            "valueLabel": "+0.8626905u",
            "cost": 165,
            "currencyId": "gem.sapphire",
            "requiredBossTier": 3,
            "prerequisiteNodeId": "stat.radius.06",
            "startsUnlocked": false,
            "operation": "add",
            "value": 0.8626905
          },
          {
            "id": "stat.radius.08",
            "displayName": "Automatic Radius 8",
            "description": "Add 1.7253809u to the cursor attack radius.",
            "valueLabel": "+1.7253809u",
            "cost": 190,
            "currencyId": "gem.sapphire",
            "requiredBossTier": 3,
            "prerequisiteNodeId": "stat.radius.07",
            "startsUnlocked": false,
            "operation": "add",
            "value": 1.7253809
          },
          {
            "id": "stat.radius.09",
            "displayName": "Automatic Radius 9",
            "description": "Add 3.4507618u to the cursor attack radius.",
            "valueLabel": "+3.4507618u",
            "cost": 215,
            "currencyId": "gem.diamond",
            "requiredBossTier": 4,
            "prerequisiteNodeId": "stat.radius.08",
            "startsUnlocked": false,
            "operation": "add",
            "value": 3.4507618
          },
          {
            "id": "stat.radius.10",
            "displayName": "Automatic Radius 10",
            "description": "Add 5.1761427u to the cursor attack radius.",
            "valueLabel": "+5.1761427u",
            "cost": 240,
            "currencyId": "gem.diamond",
            "requiredBossTier": 4,
            "prerequisiteNodeId": "stat.radius.09",
            "startsUnlocked": false,
            "operation": "add",
            "value": 5.1761427
          },
          {
            "id": "stat.radius.11",
            "displayName": "Automatic Radius 11",
            "description": "Add 20.7045708u to the cursor attack radius.",
            "valueLabel": "+20.7045708u",
            "cost": 265,
            "currencyId": "gem.dragon",
            "requiredBossTier": 5,